URL,Caption
https://ifh.cc/g/zr8zb4.jpg,화관을 쓴 여성이 눈을 감고 있던 상태에서 갑자기 눈을 크게 뜨는 두 장의 사진입니다.
https://ifh.cc/g/CJ3D9y.jpg,화장실 변기에 올라간 귀여운 어린아이가 호기심 가득한 눈으로 바라보며 손으로 변기 속의 물건을 만지고 있습니다.
https://ifh.cc/g/3ZLoHm.jpg,"강렬한 무대 조명 아래에서 한 사람이 유명한 경사진 발끝 서기 포즈를 취하고 있는 가운데, 다른 사람의 실루엣이 바라보고 있습니다."
https://ifh.cc/g/yj391z.jpg,열린 차량 문에서 밖으로 활짝 웃으며 팔을 벌린 소년이 보입니다.
https://ifh.cc/g/aDQnOS.jpg,파란 셔츠와 넥타이를 맨 사람이 놀란 표정으로 양팔을 벌리고 있는 만화 스타일의 그림입니다.
https://ifh.cc/g/Fg1WLR.jpg,검은 망토를 입고 빨간색 광선검을 든 인물이 어두운 하늘 배경 앞에 서 있다.
https://ifh.cc/g/D8rRJS.jpg,의사가 청진기를 사용하여 상의를 벗은 환자의 심장을 듣고 있는 모습입니다.
https://ifh.cc/g/Zn9Pag.jpg,남자가 자연 속에서 아기를 안고 밝게 웃고 있습니다.
https://ifh.cc/g/dtHZ28.jpg,그림 속에서 두 명의 애니메이션 캐릭터가 그네에 앉아 서로를 바라보며 대화하는 듯한 장면이 펼쳐지고 있습니다.
https://ifh.cc/g/GFTy2x.jpg,자연 배경 앞에서 포즈를 취하고 있는 보라색과 녹색의 로봇 애니메이션 캐릭터가 그려진 이미지입니다.
https://ifh.cc/g/4b8WrN.jpg,"군복 차림의 여러 남성이 박수를 치고 있는 모습이며, 그들 중 한 명은 민간 복장을 입고 있습니다."
https://ifh.cc/g/wptvah.jpg,긴 금발 머리카락에 진지한 표정을 짓고 있는 애니메이션 캐릭터의 클로즈업 이미지입니다.
https://ifh.cc/g/jL27la.jpg,이 사진은 사람의 등에 붉게 일광 화상을 입은 부분을 제외하고 선크림을 바른 손자국이 선명하게 나타나 있는 모습을 보여줍니다.
https://ifh.cc/g/qKdJWf.jpg,고질라 모형이 입에서 연기를 내뿜으며 포효하는 듯 보이는 야외 장면이다.
https://ifh.cc/g/pkZYFW.jpg,병상에 누워있는 여성을 바라보며 슬퍼하는 듯한 남성이 손으로 입을 가리고 있는 모습입니다.
